{
  "schema_version": 1,
  "daskam_id": 4,
  "updated_at": "2026-09-24T01:20:43.484727Z",
  "stanzas": [
    {
      "n": 1,
      "concept_id": "d004-s001",
      "alt": "Bhattathiri prays for strength to practise yoga",
      "landscape": {
        "status": "planned",
        "master_path": null,
        "preview_path": null,
        "sha256": null
      },
      "portrait": {
        "status": "planned",
        "master_path": null,
        "preview_path": null,
        "sha256": null
      }
    },
    {
      "n": 2,
      "concept_id": "d004-s002",
      "alt": "Bhattathiri begins the disciplines of yoga",
      "landscape": {
        "status": "planned",
        "master_path": null,
        "preview_path": null,
        "sha256": null
      },
      "portrait": {
        "status": "planned",
        "master_path": null,
        "preview_path": null,
        "sha256": null
      }
    },
    {
      "n": 3,
      "concept_id": "d004-s003",
      "alt": "Breath and senses settle into meditation",
      "landscape": {
        "status": "planned",
        "master_path": null,
        "preview_path": null,
        "sha256": null
      },
      "portrait": {
        "status": "planned",
        "master_path": null,
        "preview_path": null,
        "sha256": null
      }
    },
    {
      "n": 4,
      "concept_id": "d004-s004",
      "alt": "The Lord’s lotus feet first appear in concentration",
      "landscape": {
        "status": "planned",
        "master_path": null,
        "preview_path": null,
        "sha256": null
      },
      "portrait": {
        "status": "planned",
        "master_path": null,
        "preview_path": null,
        "sha256": null
      }
    },
    {
      "n": 5,
      "concept_id": "d004-s005",
      "alt": "The Lord’s form grows clear in meditation",
      "landscape": {
        "status": "planned",
        "master_path": null,
        "preview_path": null,
        "sha256": null
      },
      "portrait": {
        "status": "planned",
        "master_path": null,
        "preview_path": null,
        "sha256": null
      }
    },
    {
      "n": 6,
      "concept_id": "d004-s006",
      "alt": "Contemplation of divine form opens toward the formless",
      "landscape": {
        "status": "planned",
        "master_path": null,
        "preview_path": null,
        "sha256": null
      },
      "portrait": {
        "status": "planned",
        "master_path": null,
        "preview_path": null,
        "sha256": null
      }
    },
    {
      "n": 7,
      "concept_id": "d004-s007",
      "alt": "Bhattathiri gently returns to concentration",
      "landscape": {
        "status": "planned",
        "master_path": null,
        "preview_path": null,
        "sha256": null
      },
      "portrait": {
        "status": "planned",
        "master_path": null,
        "preview_path": null,
        "sha256": null
      }
    },
    {
      "n": 8,
      "concept_id": "d004-s008",
      "alt": "A prayer to move freely among liberated devotees",
      "landscape": {
        "status": "planned",
        "master_path": null,
        "preview_path": null,
        "sha256": null
      },
      "portrait": {
        "status": "planned",
        "master_path": null,
        "preview_path": null,
        "sha256": null
      }
    },
    {
      "n": 9,
      "concept_id": "d004-s009",
      "alt": "Breath rises through the subtle centres",
      "landscape": {
        "status": "planned",
        "master_path": null,
        "preview_path": null,
        "sha256": null
      },
      "portrait": {
        "status": "planned",
        "master_path": null,
        "preview_path": null,
        "sha256": null
      }
    },
    {
      "n": 10,
      "concept_id": "d004-s010",
      "alt": "The yogi contemplates liberation and onward passage",
      "landscape": {
        "status": "planned",
        "master_path": null,
        "preview_path": null,
        "sha256": null
      },
      "portrait": {
        "status": "planned",
        "master_path": null,
        "preview_path": null,
        "sha256": null
      }
    },
    {
      "n": 11,
      "concept_id": "d004-s011",
      "alt": "The devotee follows the luminous path",
      "landscape": {
        "status": "planned",
        "master_path": null,
        "preview_path": null,
        "sha256": null
      },
      "portrait": {
        "status": "planned",
        "master_path": null,
        "preview_path": null,
        "sha256": null
      }
    },
    {
      "n": 12,
      "concept_id": "d004-s012",
      "alt": "The devotee seeks refuge beyond cosmic fire",
      "landscape": {
        "status": "planned",
        "master_path": null,
        "preview_path": null,
        "sha256": null
      },
      "portrait": {
        "status": "planned",
        "master_path": null,
        "preview_path": null,
        "sha256": null
      }
    },
    {
      "n": 13,
      "concept_id": "d004-s013",
      "alt": "Liberation in the divine abode",
      "landscape": {
        "status": "planned",
        "master_path": null,
        "preview_path": null,
        "sha256": null
      },
      "portrait": {
        "status": "planned",
        "master_path": null,
        "preview_path": null,
        "sha256": null
      }
    },
    {
      "n": 14,
      "concept_id": "d004-s014",
      "alt": "The devotee passes through the cosmic sheaths",
      "landscape": {
        "status": "planned",
        "master_path": null,
        "preview_path": null,
        "sha256": null
      },
      "portrait": {
        "status": "planned",
        "master_path": null,
        "preview_path": null,
        "sha256": null
      }
    },
    {
      "n": 15,
      "concept_id": "d004-s015",
      "alt": "Bhattathiri asks the Lord’s protection",
      "landscape": {
        "status": "planned",
        "master_path": null,
        "preview_path": null,
        "sha256": null
      },
      "portrait": {
        "status": "planned",
        "master_path": null,
        "preview_path": null,
        "sha256": null
      }
    }
  ]
}
