{
  "schema_version": 1,
  "daskam_id": 2,
  "updated_at": "2026-09-11T23:20:13.671Z",
  "stanzas": [
    {
      "n": 1,
      "concept_id": "d002-s001",
      "alt": "The radiant crowned form of Guruvayurappan",
      "landscape": {
        "status": "missing",
        "master_path": null,
        "preview_path": null,
        "sha256": null
      },
      "portrait": {
        "status": "missing",
        "master_path": null,
        "preview_path": null,
        "sha256": null
      }
    },
    {
      "n": 2,
      "concept_id": "d002-s002",
      "alt": "The four-armed Lord as refuge from sorrow",
      "landscape": {
        "status": "missing",
        "master_path": null,
        "preview_path": null,
        "sha256": null
      },
      "portrait": {
        "status": "missing",
        "master_path": null,
        "preview_path": null,
        "sha256": null
      }
    },
    {
      "n": 3,
      "concept_id": "d002-s003",
      "alt": "The Lord whose beauty surpasses the three worlds",
      "landscape": {
        "status": "missing",
        "master_path": null,
        "preview_path": null,
        "sha256": null
      },
      "portrait": {
        "status": "missing",
        "master_path": null,
        "preview_path": null,
        "sha256": null
      }
    },
    {
      "n": 4,
      "concept_id": "d002-s004",
      "alt": "Lakshmi captivated by the Lord's beauty",
      "landscape": {
        "status": "missing",
        "master_path": null,
        "preview_path": null,
        "sha256": null
      },
      "portrait": {
        "status": "missing",
        "master_path": null,
        "preview_path": null,
        "sha256": null
      }
    },
    {
      "n": 5,
      "concept_id": "d002-s005",
      "alt": "Lakshmi dwelling among devotees who sing the Lord's glory",
      "landscape": {
        "status": "missing",
        "master_path": null,
        "preview_path": null,
        "sha256": null
      },
      "portrait": {
        "status": "missing",
        "master_path": null,
        "preview_path": null,
        "sha256": null
      }
    },
    {
      "n": 6,
      "concept_id": "d002-s006",
      "alt": "Devotees overwhelmed by bliss while hearing the Lord's stories",
      "landscape": {
        "status": "missing",
        "master_path": null,
        "preview_path": null,
        "sha256": null
      },
      "portrait": {
        "status": "missing",
        "master_path": null,
        "preview_path": null,
        "sha256": null
      }
    },
    {
      "n": 7,
      "concept_id": "d002-s007",
      "alt": "The effortless path of loving devotion",
      "landscape": {
        "status": "missing",
        "master_path": null,
        "preview_path": null,
        "sha256": null
      },
      "portrait": {
        "status": "missing",
        "master_path": null,
        "preview_path": null,
        "sha256": null
      }
    },
    {
      "n": 8,
      "concept_id": "d002-s008",
      "alt": "Bhakti as the sweetest path beyond difficult karma and knowledge",
      "landscape": {
        "status": "missing",
        "master_path": null,
        "preview_path": null,
        "sha256": null
      },
      "portrait": {
        "status": "missing",
        "master_path": null,
        "preview_path": null,
        "sha256": null
      }
    },
    {
      "n": 9,
      "concept_id": "d002-s009",
      "alt": "The long paths of discipline and reasoning beside melting devotion",
      "landscape": {
        "status": "missing",
        "master_path": null,
        "preview_path": null,
        "sha256": null
      },
      "portrait": {
        "status": "missing",
        "master_path": null,
        "preview_path": null,
        "sha256": null
      }
    },
    {
      "n": 10,
      "concept_id": "d002-s010",
      "alt": "A devotee immersed in the nectar of the Lord's stories",
      "landscape": {
        "status": "missing",
        "master_path": null,
        "preview_path": null,
        "sha256": null
      },
      "portrait": {
        "status": "missing",
        "master_path": null,
        "preview_path": null,
        "sha256": null
      }
    }
  ]
}
