{
  "schema_version": 1,
  "daskam_id": 38,
  "updated_at": "2026-09-04T05:30:00.000Z",
  "stanzas": [
    { "n": 1, "concept_id": "d038-s001", "alt": "Monsoon clouds over Mathura glow with the blue radiance preceding Krishna's birth", "landscape": { "status": "missing", "master_path": null, "preview_path": null, "sha256": null }, "portrait": { "status": "missing", "master_path": null, "preview_path": null, "sha256": null } },
    { "n": 2, "concept_id": "d038-s002", "alt": "Krishna appears at midnight before Devaki and Vasudeva in the rain-cooled prison", "landscape": { "status": "missing", "master_path": null, "preview_path": null, "sha256": null }, "portrait": { "status": "missing", "master_path": null, "preview_path": null, "sha256": null } },
    { "n": 3, "concept_id": "d038-s003", "alt": "Newborn Krishna reveals his four-armed divine form with conch, discus, lotus, and mace", "landscape": { "status": "missing", "master_path": null, "preview_path": null, "sha256": null }, "portrait": { "status": "missing", "master_path": null, "preview_path": null, "sha256": null } },
    { "n": 4, "concept_id": "d038-s004", "alt": "Lakshmi's lotus-gold grace shines from Krishna's chest and dispels the prison's darkness", "landscape": { "status": "missing", "master_path": null, "preview_path": null, "sha256": null }, "portrait": { "status": "missing", "master_path": null, "preview_path": null, "sha256": null } },
    { "n": 5, "concept_id": "d038-s005", "alt": "Vasudeva beholds Krishna with tears of joy and begins his prayer", "landscape": { "status": "missing", "master_path": null, "preview_path": null, "sha256": null }, "portrait": { "status": "missing", "master_path": null, "preview_path": null, "sha256": null } },
    { "n": 6, "concept_id": "d038-s006", "alt": "Vasudeva prays as Krishna's compassionate glance dissolves the creeper of sorrow", "landscape": { "status": "missing", "master_path": null, "preview_path": null, "sha256": null }, "portrait": { "status": "missing", "master_path": null, "preview_path": null, "sha256": null } },
    { "n": 7, "concept_id": "d038-s007", "alt": "At Devaki's prayer, Krishna's four-armed divine form becomes a human infant", "landscape": { "status": "missing", "master_path": null, "preview_path": null, "sha256": null }, "portrait": { "status": "missing", "master_path": null, "preview_path": null, "sha256": null } },
    { "n": 8, "concept_id": "d038-s008", "alt": "Vasudeva lifts the infant Krishna in hands compared to a lotus bearing a young swan", "landscape": { "status": "missing", "master_path": null, "preview_path": null, "sha256": null }, "portrait": { "status": "missing", "master_path": null, "preview_path": null, "sha256": null } },
    { "n": 9, "concept_id": "d038-s009", "alt": "As Yogamaya sends the guards to sleep, the locked prison doors open for Vasudeva", "landscape": { "status": "missing", "master_path": null, "preview_path": null, "sha256": null }, "portrait": { "status": "missing", "master_path": null, "preview_path": null, "sha256": null } },
    { "n": 10, "concept_id": "d038-s010", "alt": "Adishesha shelters Vasudeva and infant Krishna during the storm-lit journey to Gokulam", "landscape": { "status": "missing", "master_path": null, "preview_path": null, "sha256": null }, "portrait": { "status": "missing", "master_path": null, "preview_path": null, "sha256": null } }
  ]
}
