{
  "schema_version": 1,
  "daskam_id": 1,
  "updated_at": "2026-09-04T04:54:46.586Z",
  "stanzas": [
    {
      "n": 1,
      "concept_id": "d001-s001",
      "alt": "Sri Krishna at Guruvayur",
      "landscape": {
        "status": "approved-legacy",
        "master_path": "artifacts/d001/s001/landscape/master.png",
        "preview_path": "/images/d001/s001-landscape.webp",
        "sha256": "474b71951d8716ef0a0cd242fe709353ca929a60070bf24457e2de1e5aaf77c3",
        "legacy_source_url": "https://fgnq7qx1wp3a7ars.public.blob.vercel-storage.com/daskam-01/masters/d01-s01-teach-v3.png"
      },
      "portrait": {
        "status": "missing",
        "master_path": null,
        "preview_path": null,
        "sha256": null
      }
    },
    {
      "n": 2,
      "concept_id": "d001-s002",
      "alt": "Choosing devotion over worldly distractions",
      "landscape": {
        "status": "approved-legacy",
        "master_path": "artifacts/d001/s002/landscape/master.png",
        "preview_path": "/images/d001/s002-landscape.webp",
        "sha256": "6f33ccaf0f7e68c03ea3386f35a17435a32a2255091c6684e8b8e63e8970d3d4",
        "legacy_source_url": "https://fgnq7qx1wp3a7ars.public.blob.vercel-storage.com/daskam-01/masters/d01-s02-01.png"
      },
      "portrait": {
        "status": "missing",
        "master_path": null,
        "preview_path": null,
        "sha256": null
      }
    },
    {
      "n": 3,
      "concept_id": "d001-s003",
      "alt": "The pure sattva form revealing bliss and consciousness",
      "landscape": {
        "status": "approved-legacy",
        "master_path": "artifacts/d001/s003/landscape/master.png",
        "preview_path": "/images/d001/s003-landscape.webp",
        "sha256": "94302f3c83ceca0d38e92cd06437110ceea3b09f36d499520ef475ea89091a2f",
        "legacy_source_url": "https://fgnq7qx1wp3a7ars.public.blob.vercel-storage.com/daskam-01/masters/d01-s03-teach.png"
      },
      "portrait": {
        "status": "missing",
        "master_path": null,
        "preview_path": null,
        "sha256": null
      }
    },
    {
      "n": 4,
      "concept_id": "d001-s004",
      "alt": "Daskam 1 — Sloka 4",
      "landscape": {
        "status": "approved-legacy",
        "master_path": "artifacts/d001/s004/landscape/master.png",
        "preview_path": "/images/d001/s004-landscape.webp",
        "sha256": "9fe353cac5bb27947bc469e904d9f1e1303abde3275869a78f8a8bb553aad46d",
        "legacy_source_url": "https://fgnq7qx1wp3a7ars.public.blob.vercel-storage.com/daskam-01/masters/d01-s04.png"
      },
      "portrait": {
        "status": "missing",
        "master_path": null,
        "preview_path": null,
        "sha256": null
      }
    },
    {
      "n": 5,
      "concept_id": "d001-s005",
      "alt": "Daskam 1 — Sloka 5",
      "landscape": {
        "status": "approved-legacy",
        "master_path": "artifacts/d001/s005/landscape/master.png",
        "preview_path": "/images/d001/s005-landscape.webp",
        "sha256": "e778ee61a85790395d5beb596023f5d3402996c385ba818082751af84833114c",
        "legacy_source_url": "https://fgnq7qx1wp3a7ars.public.blob.vercel-storage.com/daskam-01/masters/d01-s05.png"
      },
      "portrait": {
        "status": "missing",
        "master_path": null,
        "preview_path": null,
        "sha256": null
      }
    },
    {
      "n": 6,
      "concept_id": "d001-s006",
      "alt": "Daskam 1 — Sloka 6",
      "landscape": {
        "status": "approved-legacy",
        "master_path": "artifacts/d001/s006/landscape/master.png",
        "preview_path": "/images/d001/s006-landscape.webp",
        "sha256": "17850c25343372076590d1e5358f6d87c198b28a1b5a25c0d622b0b6fb46c687",
        "legacy_source_url": "https://fgnq7qx1wp3a7ars.public.blob.vercel-storage.com/daskam-01/masters/d01-s06.png"
      },
      "portrait": {
        "status": "missing",
        "master_path": null,
        "preview_path": null,
        "sha256": null
      }
    },
    {
      "n": 7,
      "concept_id": "d001-s007",
      "alt": "Daskam 1 — Sloka 7",
      "landscape": {
        "status": "approved-legacy",
        "master_path": "artifacts/d001/s007/landscape/master.png",
        "preview_path": "/images/d001/s007-landscape.webp",
        "sha256": "711814d667f8dd04f59becb73ef7df0d617bd42c909751a5652566964a73f885",
        "legacy_source_url": "https://fgnq7qx1wp3a7ars.public.blob.vercel-storage.com/daskam-01/masters/d01-s07.png"
      },
      "portrait": {
        "status": "missing",
        "master_path": null,
        "preview_path": null,
        "sha256": null
      }
    },
    {
      "n": 8,
      "concept_id": "d001-s008",
      "alt": "Daskam 1 — Sloka 8",
      "landscape": {
        "status": "approved-legacy",
        "master_path": "artifacts/d001/s008/landscape/master.png",
        "preview_path": "/images/d001/s008-landscape.webp",
        "sha256": "9ec5a6aee85086fbb4ea45c555b1a8c33fbb1624306cc6e77a2b48969043e995",
        "legacy_source_url": "https://fgnq7qx1wp3a7ars.public.blob.vercel-storage.com/daskam-01/masters/d01-s08.png"
      },
      "portrait": {
        "status": "missing",
        "master_path": null,
        "preview_path": null,
        "sha256": null
      }
    },
    {
      "n": 9,
      "concept_id": "d001-s009",
      "alt": "Daskam 1 — Sloka 9",
      "landscape": {
        "status": "approved-legacy",
        "master_path": "artifacts/d001/s009/landscape/master.png",
        "preview_path": "/images/d001/s009-landscape.webp",
        "sha256": "4469ea8c00f9a442fe4abea755bcffa55a998dca3d098e154255a0ef86401b5f",
        "legacy_source_url": "https://fgnq7qx1wp3a7ars.public.blob.vercel-storage.com/daskam-01/masters/d01-s09.png"
      },
      "portrait": {
        "status": "missing",
        "master_path": null,
        "preview_path": null,
        "sha256": null
      }
    },
    {
      "n": 10,
      "concept_id": "d001-s010",
      "alt": "Daskam 1 — Sloka 10",
      "landscape": {
        "status": "approved-legacy",
        "master_path": "artifacts/d001/s010/landscape/master.png",
        "preview_path": "/images/d001/s010-landscape.webp",
        "sha256": "9b30a8ef348206d9c60738a1a2a1da49debc21d4fdd20c51c5968a1409718eed",
        "legacy_source_url": "https://fgnq7qx1wp3a7ars.public.blob.vercel-storage.com/daskam-01/masters/d01-s10.png"
      },
      "portrait": {
        "status": "missing",
        "master_path": null,
        "preview_path": null,
        "sha256": null
      }
    }
  ]
}
